{
  "version": 1,
  "last_updated": "2026-03-16",
  "total_models_ranked": 242,
  "sources": [
    {
      "name": "chatbot-arena",
      "url": "https://arena.ai/leaderboard",
      "description": "Human preference rankings from Chatbot Arena (LMSYS). Scores normalized 0-100 from rank position across 242 models."
    }
  ],
  "models": {
    "anthropic/claude-opus-4-6": {
      "overall": 93,
      "primary_source": "chatbot-arena",
      "arena_elo": 1406.3,
      "arena_rank": 19,
      "coding": 99,
      "reasoning": 98,
      "math": 97,
      "creative_writing": 97,
      "instruction_following": 99
    },
    "anthropic/claude-opus-4-20250514": {
      "overall": 83,
      "primary_source": "chatbot-arena",
      "arena_elo": 1362.4,
      "arena_rank": 41,
      "coding": 87,
      "reasoning": 88,
      "math": 84,
      "creative_writing": 92,
      "instruction_following": 91
    },
    "anthropic/claude-sonnet-4-6": {
      "overall": 98,
      "coding": 98,
      "reasoning": 98,
      "math": 99,
      "creative_writing": 98,
      "instruction_following": 99,
      "arena_rank": 16,
      "primary_source": "chatbot-arena"
    },
    "anthropic/claude-sonnet-4-20250514": {
      "overall": 76,
      "primary_source": "chatbot-arena",
      "arena_elo": 1333.8,
      "arena_rank": 58,
      "coding": 83,
      "reasoning": 80,
      "math": 80,
      "creative_writing": 84,
      "instruction_following": 85
    },
    "anthropic/claude-haiku-4-5-20251001": {
      "overall": 51,
      "primary_source": "chatbot-arena",
      "arena_elo": 1256.4,
      "arena_rank": 120,
      "coding": 57,
      "reasoning": 53,
      "math": 51,
      "creative_writing": 50,
      "instruction_following": 53
    },
    "openai/gpt-4o": {
      "overall": 67,
      "primary_source": "chatbot-arena",
      "arena_elo": 1302.7,
      "arena_rank": 81,
      "coding": 64,
      "reasoning": 64,
      "math": 66,
      "creative_writing": 73,
      "instruction_following": 67
    },
    "openai/gpt-4o-mini": {
      "overall": 63,
      "primary_source": "chatbot-arena",
      "arena_elo": 1289.2,
      "arena_rank": 91,
      "coding": 61,
      "reasoning": 60,
      "math": 56,
      "creative_writing": 64,
      "instruction_following": 60
    },
    "openai/gpt-4.1": {
      "overall": 89,
      "primary_source": "chatbot-arena",
      "arena_elo": 1380.7,
      "arena_rank": 27,
      "coding": 86,
      "reasoning": 88,
      "math": 78,
      "creative_writing": 90,
      "instruction_following": 90
    },
    "openai/gpt-4.1-mini": {
      "overall": 79,
      "primary_source": "chatbot-arena",
      "arena_elo": 1341.5,
      "arena_rank": 51,
      "coding": 80,
      "reasoning": 80,
      "math": 76,
      "creative_writing": 74,
      "instruction_following": 80
    },
    "openai/gpt-4.1-nano": {
      "overall": 62,
      "primary_source": "chatbot-arena",
      "arena_elo": 1287.5,
      "arena_rank": 93,
      "coding": 67,
      "reasoning": 65,
      "math": 61,
      "creative_writing": 61,
      "instruction_following": 64
    },
    "openai/o3": {
      "overall": 96,
      "primary_source": "chatbot-arena",
      "arena_elo": 1420.7,
      "arena_rank": 10,
      "coding": 96,
      "reasoning": 94,
      "math": 97,
      "creative_writing": 92,
      "instruction_following": 92
    },
    "openai/o3-mini": {
      "overall": 78,
      "primary_source": "chatbot-arena",
      "arena_elo": 1338.3,
      "arena_rank": 55,
      "coding": 83,
      "reasoning": 84,
      "math": 88,
      "creative_writing": 71,
      "instruction_following": 82
    },
    "openai/o4-mini": {
      "overall": 83,
      "primary_source": "chatbot-arena",
      "arena_elo": 1359,
      "arena_rank": 42,
      "coding": 84,
      "reasoning": 81,
      "math": 90,
      "creative_writing": 76,
      "instruction_following": 80
    },
    "google/gemini-2.0-flash": {
      "overall": 82,
      "primary_source": "chatbot-arena",
      "arena_elo": 1358.2,
      "arena_rank": 45,
      "coding": 78,
      "reasoning": 80,
      "math": 79,
      "creative_writing": 85,
      "instruction_following": 82
    },
    "google/gemini-2.0-flash-lite": {
      "overall": 75,
      "primary_source": "chatbot-arena",
      "arena_elo": 1330.8,
      "arena_rank": 62,
      "coding": 71,
      "reasoning": 74,
      "math": 72,
      "creative_writing": 80,
      "instruction_following": 75
    },
    "google/gemini-2.5-flash": {
      "overall": 93,
      "primary_source": "chatbot-arena",
      "arena_elo": 1408.9,
      "arena_rank": 18,
      "coding": 92,
      "reasoning": 93,
      "math": 96,
      "creative_writing": 98,
      "instruction_following": 95
    },
    "google/gemini-3-flash-preview": {
      "overall": 99,
      "coding": 98,
      "reasoning": 99,
      "math": 99,
      "creative_writing": 99,
      "instruction_following": 98,
      "arena_rank": 8,
      "primary_source": "chatbot-arena"
    },
    "google/gemini-3.1-pro-preview": {
      "overall": 100,
      "coding": 99,
      "reasoning": 100,
      "math": 100,
      "creative_writing": 100,
      "instruction_following": 100,
      "arena_rank": 4,
      "primary_source": "chatbot-arena"
    },
    "google/gemini-3.1-flash-lite-preview": {
      "overall": 94,
      "coding": 89,
      "reasoning": 93,
      "math": 92,
      "creative_writing": 96,
      "instruction_following": 92,
      "arena_rank": 35,
      "primary_source": "chatbot-arena"
    },
    "xai/grok-3": {
      "overall": 97,
      "primary_source": "chatbot-arena",
      "arena_elo": 1423.1,
      "arena_rank": 8,
      "coding": 96,
      "reasoning": 98,
      "math": 87,
      "creative_writing": 100,
      "instruction_following": 98
    },
    "xai/grok-3-mini": {
      "overall": 85,
      "primary_source": "chatbot-arena",
      "arena_elo": 1366.4,
      "arena_rank": 37,
      "coding": 82,
      "reasoning": 85,
      "math": 85,
      "creative_writing": 86,
      "instruction_following": 86
    },
    "google/gemini-2.5-pro": {
      "overall": 100,
      "primary_source": "chatbot-arena",
      "arena_elo": 1466.2,
      "arena_rank": 1,
      "coding": 100,
      "reasoning": 100,
      "math": 100,
      "creative_writing": 100,
      "instruction_following": 100
    },
    "anthropic/claude-3-5-haiku-20241022": {
      "overall": 51,
      "primary_source": "chatbot-arena",
      "arena_elo": 1256.4,
      "arena_rank": 120,
      "coding": 57,
      "reasoning": 53,
      "math": 51,
      "creative_writing": 50,
      "instruction_following": 53,
      "note": "Uses claude-haiku-4-5-20251001 scores (same model, older ID)"
    },
    "xai/grok-3-vision": {
      "overall": 97,
      "primary_source": "chatbot-arena",
      "arena_elo": 1423.1,
      "arena_rank": 8,
      "coding": 96,
      "reasoning": 98,
      "math": 87,
      "creative_writing": 100,
      "instruction_following": 98,
      "note": "Uses grok-3 scores (same model, older ID)"
    },
    "google/gemini-2.5-flash-lite": {
      "overall": 75,
      "primary_source": "chatbot-arena",
      "arena_elo": 1330.8,
      "arena_rank": 62,
      "coding": 71,
      "reasoning": 74,
      "math": 72,
      "creative_writing": 80,
      "instruction_following": 75,
      "note": "Uses gemini-2.0-flash-lite scores (same model, older ID)"
    },
    "perplexity/sonar": {
      "overall": 70,
      "coding": 65,
      "reasoning": 68,
      "creative_writing": 72,
      "instruction_following": 70,
      "primary_source": "estimate",
      "note": "Not ranked on Arena. Estimated from similar-tier models."
    },
    "perplexity/sonar-pro": {
      "overall": 78,
      "coding": 72,
      "reasoning": 76,
      "creative_writing": 78,
      "instruction_following": 76,
      "primary_source": "estimate",
      "note": "Not ranked on Arena. Estimated from similar-tier models."
    },
    "perplexity/sonar-reasoning-pro": {
      "overall": 82,
      "coding": 76,
      "reasoning": 84,
      "creative_writing": 78,
      "instruction_following": 80,
      "primary_source": "estimate",
      "note": "Not ranked on Arena. Estimated from similar-tier models."
    },
    "perplexity/sonar-deep-research": {
      "overall": 82,
      "coding": 76,
      "reasoning": 84,
      "creative_writing": 78,
      "instruction_following": 80,
      "primary_source": "estimate",
      "note": "Not ranked on Arena. Estimated from similar-tier models."
    }
  }
}
